year,title,url,count
2024,A 2D nGPT Model For ARC Prize,https://arcprize.org/competitions/2024/,1
2024,A 2D nGPT Model for ARC Prize,https://arxiv.org/pdf/2412.04604.pdf,1
1948,A Mathematical Theory of Communication,https://ia803209.us.archive.org/27/items/bstj27-3-379/bstj27-3-379_text.pdf,1
2025,ARC Is a Vision Problem! + test-time training theme (indexed by ARC Prize 2025),https://arcprize.org/blog/arc-prize-2025-results-analysis,1
2024,ARC Prize 2024: Technical Report,MISSING,1
2025,ARC-AGI Without Pretraining (CompressARC),https://iliao2345.github.io/blog_posts/arc_agi_without_pretraining/ARC_AGI_Without_Pretraining.pdf,1
2025,ARC-AGI Without Pretraining (CompressARC),https://arcprize.org/blog/arc-prize-2025-results-analysis,1
2025,ARC-AGI is a Vision Problem!,https://arcprize.org/blog/arc-prize-2025-results-analysis,1
2024,ARC-Heavy / ARC-Potpourri (dataset description embedded in Cornell report),https://www.cs.cornell.edu/~ellisk/documents/arc_induction_vs_transduction.pdf,1
2025,ARC-NCA: Towards Developmental Solutions to the Abstraction and Reasoning Corpus,https://arxiv.org/pdf/2505.08778.pdf,1
2025,ARC-NCA: Towards Developmental Solutions to the Abstraction and Reasoning Corpus,https://arcprize.org/blog/arc-prize-2025-results-analysis,1
2018,Accelerating Search-Based Program Synthesis using Learned Probabilistic Models (Euphony),https://www.cis.upenn.edu/~alur/PLDI18.pdf,1
2025,ArcMemo: Abstract Reasoning Composition with Lifelong LLM Memory,https://ar5iv.org/abs/2509.04439,1
2025,ArcMemo: Abstract Reasoning Composition with Lifelong LLM Memory,https://arcprize.org/blog/arc-prize-2025-results-analysis,1
2011,Automating String Processing in Spreadsheets Using Input-Output Examples (FlashFill),https://www.microsoft.com/en-us/research/wp-content/uploads/2016/12/popl11-synthesis.pdf,1
2011,Automating String Processing in Spreadsheets using Input-Output Examples (FlashFill),https://www.microsoft.com/en-us/research/wp-content/uploads/2016/12/synasc12.pdf,1
2025,Beyond Brute Force: A Neuro-Symbolic Architecture for Compositional Reasoning in ARC-AGI-2,https://arcprize.org/blog/arc-prize-2025-results-analysis,1
2025,Boosting Performance on ARC via Perspective / Augmentations,https://proceedings.mlr.press/v267/franzen25a.html,1
2024,Combining Induction and Transduction for Abstract Reasoning,https://arcprize.org/competitions/2024/,1
2010,Component-based Synthesis Applied to Bitvector Programs,https://www.microsoft.com/en-us/research/wp-content/uploads/2010/02/bv.pdf,1
2025,Don't throw the baby out with the bathwater: How and why deep learning for ARC,https://arcprize.org/blog/arc-prize-2025-results-analysis,1
1991,"Dyna, an Integrated Architecture for Learning, Planning, and Reacting",https://dl.acm.org/doi/abs/10.1145/122344.122377,1
2025,Efficient Evolutionary Program Synthesis,https://arcprize.org/blog/arc-prize-2025-results-analysis,1
2024,Evolutionary Test-Time Compute (write-up),https://jeremyberman.substack.com/p/how-i-got-a-record-536-on-arc-agi,1
2025,Exploring the combination of search and learn for the ARC25 challenge,https://arcprize.org/blog/arc-prize-2025-results-analysis,1
2025,From Parrots to Von Neumanns: How Evolutionary Test-Time Compute Achieved SOTA on ARC-AGI,https://arcprize.org/blog/arc-prize-2025-results-analysis,1
2025,H-ARC (Human-ARC): A Comprehensive Behavioral Dataset for the Abstraction and Reasoning Corpus,https://www.nature.com/articles/s41597-025-05687-1,1
2024,HiRoPE: Length Extrapolation for Code Models Using Hierarchical Rotary Position Embedding,https://aclanthology.org/2024.acl-long.735/,1
2025,Hierarchical Reasoning Model (HRM),https://arxiv.org/pdf/2506.21734.pdf,1
2014,Hierarchy of Intrinsic Timescales in Cortex,https://www.cns.nyu.edu/wanglab/publications/pdf/murray.nn2014.pdf,1
2009,ImageNet: A Large-Scale Hierarchical Image Database,https://www.image-net.org/static_files/papers/imagenet_cvpr09.pdf,1
2018,Improving Language Understanding by Generative Pre-Training,https://cdn.openai.com/research-covers/language-unsupervised/language_understanding_paper.pdf,1
2024,LLFormer4D: LiDAR-based lane detection method,https://ietresearch.onlinelibrary.wiley.com/doi/10.1049/cvi2.12338,1
2025,Less is More: Recursive Reasoning with Tiny Networks (TRM),https://arcprize.org/blog/arc-prize-2025-results-analysis,1
2023,Mask4D: End-to-End Mask-Based 4D Panoptic Segmentation for LiDAR Sequences,https://www.ipb.uni-bonn.de/wp-content/papercite-data/pdf/marcuzzi2023ral-meem.pdf,1
2016,Mastering the Game of Go with Deep Neural Networks and Tree Search (AlphaGo),https://www.nature.com/articles/nature16961,1
2025,MindsAI,https://arcprize.org/competitions/2025/,1
2024,Mini-ARC: Solving Abstraction and Reasoning Puzzles with Small Transformer Models,https://www.paulfletcherhill.com/mini-arc.pdf,1
2024,Mini-ARC: Solving Abstraction and Reasoning Puzzles with Small Transformer Models,https://arcprize.org/competitions/2024/,1
2025,NVARC,https://arcprize.org/competitions/2025/,1
2025,NVARC solution to ARC-AGI-2 2025,https://arcprize.org/blog/arc-prize-2025-results-analysis,1
2025,Nested Learning: The Illusion of Deep Learning Architecture,"# ""Nested Learning (2025) — Local Copy (no public PDF link provided)""",1
2024,Omni-ARC,https://arcprize.org/blog/arc-prize-2024-winners-technical-report,1
2024,Omni-ARC,https://arcprize.org/competitions/2024/,1
2019,On the Measure of Intelligence (ARC),https://cavalab.org/srbench/,1
2019,On the Measure of Intelligence / ARC (Abstraction and Reasoning Corpus),MISSING,1
1994,On-line Q-learning Using Connectionist Systems,https://www.researchgate.net/profile/Mahesan-Niranjan/publication/2500611_On-Line_Q-Learning_Using_Connectionist_Systems/links/5438d5db0cf204cab1d6db0f/On-Line-Q-Learning-Using-Connectionist-Systems.pdf,1
2025,Product of Experts with LLMs: Boosting Performance on ARC Is a Matter of Perspective,https://arcprize.org/blog/arc-prize-2025-results-analysis,1
2025,"Productive ""refinement loop"" systems from ARC Prize writeups (2025 winners list)",https://arcprize.org/blog/arc-prize-2025-results-analysis,1
1962,"Receptive Fields, Binocular Interaction, and Functional Architecture in the Cat's Visual Cortex",https://www.gatsby.ucl.ac.uk/~lmatthey/teaching/tn1/additional/systems/JPhysiol-1962-Hubel-106-54.pdf,1
2010,Relative Entropy Policy Search (REPS),https://ojs.aaai.org/index.php/AAAI/article/view/7727,1
2025,Rethinking Visual Intelligence: Insights from Video Pretraining,https://arcprize.org/blog/arc-prize-2025-results-analysis,1
2018,Search-based Program Synthesis,https://www.cis.upenn.edu/~alur/CACM18.pdf,1
2024,Searching Latent Program Spaces,https://arcprize.org/competitions/2024/,1
2025,Self-Improving Language Models for Evolutionary Program Synthesis: A Case Study on ARC-AGI (SOAR),https://openreview.net/pdf?id=z4IG090qt2,1
2025,Self-Improving Language Models for Evolutionary Program Synthesis: A Case Study on ARC-AGI (SOAR),https://arcprize.org/blog/arc-prize-2025-results-analysis,1
2021,Swin Transformer: Hierarchical Vision Transformer using Shifted Windows,https://openaccess.thecvf.com/content/ICCV2021/papers/Liu_Swin_Transformer_Hierarchical_Vision_Transformer_Using_Shifted_Windows_ICCV_2021_paper.pdf,1
2022,Tackling the Abstraction and Reasoning Corpus with Vision Transformers: the ViTARC Architecture,https://openreview.net/forum?id=0gOQeSHNX1,1
2025,Test-time Adaptation of Tiny Recursive Models,https://arcprize.org/blog/arc-prize-2025-results-analysis,1
2024,The LLM ARChitect: Solving ARC-AGI Is a Matter of Perspective,https://arcprize.org/competitions/2024/,1
2024,The Surprising Effectiveness of Test-Time Training for Abstract Reasoning,https://arcprize.org/competitions/2024/,1
2024,Towards Efficient Neurally-Guided Program Induction for ARC-AGI,https://arcprize.org/competitions/2024/,1
1949,Translation (Weaver Memorandum),https://www.mt-archive.net/50/Weaver-1949.pdf,1
2025,Vector Symbolic Algebras for the Abstraction and Reasoning Corpus,https://arcprize.org/blog/arc-prize-2025-results-analysis,1
2025,the ARChitects,https://arcprize.org/competitions/2025/,1
