year,title,url,count
2025,CABLE: Context-aware Biases for Length Extrapolation,https://aclanthology.org/2025.emnlp-main.1545.pdf,1
2025,Context-aware Biases for Length Extrapolation (CABLE),https://aclanthology.org/2025.emnlp-main.1545.pdf,1

2024,Fixed Point Diffusion Models (FPDM),https://arxiv.org/pdf/2401.08741.pdf,1
2024,Fixed Point Diffusion Models,https://openaccess.thecvf.com/content/CVPR2024/papers/Bai_Fixed_Point_Diffusion_Models_CVPR_2024_paper.pdf,1

2018,Recurrent Relational Networks (RRN),https://papers.neurips.cc/paper/7597-recurrent-relational-networks.pdf,1
2018,Recurrent Relational Networks,https://proceedings.neurips.cc/paper_files/paper/2018/file/b9f94c77652c9a76fc8a442748cd54bd-Paper.pdf,1

2012,ImageNet Classification with Deep Convolutional Neural Networks (AlexNet),https://proceedings.neurips.cc/paper/4824-imagenet-classification-with-deep-convolutional-neural-networks.pdf,1
2012,ImageNet Classification with Deep Convolutional Neural Networks (AlexNet),https://proceedings.neurips.cc/paper_files/paper/2012/file/c399862d3b9d6b76c8436e924a68c45b-Paper.pdf,1

2015,"General Program Synthesis Benchmark Suite (PSB / ""PSB1"")",https://www.cs.hamilton.edu/~thelmuth/Pubs/2015-GECCO-benchmark-suite.pdf,1
2015,General Program Synthesis Benchmark Suite (PSB / PSB1),https://www.cs.hamilton.edu/~thelmuth/Pubs/2015-GECCO-benchmark-suite.pdf,1
2015,General Program Synthesis Benchmark Suite (PSB),https://www.cs.hamilton.edu/~thelmuth/Pubs/2015-GECCO-benchmark-suite.pdf,1
