year,title,url,count
2025,Context-aware Biases for Length Extrapolation (CABLE),https://aclanthology.org/2025.emnlp-main.1545.pdf,2
2024,Fixed Point Diffusion Models (FPDM),https://arxiv.org/pdf/2401.08741.pdf,2
2018,Recurrent Relational Networks (RRN),https://proceedings.neurips.cc/paper_files/paper/2018/file/b9f94c77652c9a76fc8a442748cd54bd-Paper.pdf,2
2012,ImageNet Classification with Deep Convolutional Neural Networks (AlexNet),https://proceedings.neurips.cc/paper_files/paper/2012/file/c399862d3b9d6b76c8436e924a68c45b-Paper.pdf,2
2015,"General Program Synthesis Benchmark Suite (PSB / ""PSB1"")",https://www.cs.hamilton.edu/~thelmuth/Pubs/2015-GECCO-benchmark-suite.pdf,3