year,title,url
2025,Vector Symbolic Algebras for the Abstraction and Reasoning Corpus,https://arcprize.org/blog/arc-prize-2025-results-analysis
2021,ViViT: A Video Vision Transformer,https://openaccess.thecvf.com/content/ICCV2021/papers/Arnab_ViViT_A_Video_Vision_Transformer_ICCV_2021_paper.pdf
1982,Vision: A Computational Investigation into the Human Representation and Processing of Visual Information,https://direct.mit.edu/books/monograph/3299/VisionA-Computational-Investigation-into-the-Human
2024,Voxel self-attention and center-point for 3D object detector,https://www.cell.com/iscience/fulltext/S2589-0042%2824%2901984-9
2025,Wavelet-based Positional Representation for Long Context,https://openreview.net/forum?id=OhauMUNW8T
